{
  "tableId": "phase22-selector-aware-source-candidates-v1",
  "schemaVersion": "1.0.0",
  "terminalStatus": "candidate-source-ready",
  "candidates": [
    {
      "sourceCandidateId": "phase22-phase12-candidate-0",
      "sourceOrigin": "internal-computed-artifact",
      "modeRole": "vector-boson-source-candidate",
      "sourceArtifactPaths": [
        "studies/phase43_selector_eigen_wz_source_spectra_001/source_spectra/spectra_manifest.json",
        "studies/phase43_selector_eigen_wz_source_spectra_001/source_spectra/mode_families.json"
      ],
      "sourceModeIds": [
        "phase12-candidate-0__bg-variant-53b598740d9569b4__L0-2x2__env-imported-repo-benchmark-mode",
        "phase12-candidate-0__bg-variant-53b598740d9569b4__L0-2x2__env-structured-4x4-mode",
        "phase12-candidate-0__bg-variant-53b598740d9569b4__L0-2x2__env-toy-2d-trivial-mode",
        "phase12-candidate-0__bg-variant-53b598740d9569b4__L1-4x4__env-imported-repo-benchmark-mode",
        "phase12-candidate-0__bg-variant-53b598740d9569b4__L1-4x4__env-structured-4x4-mode",
        "phase12-candidate-0__bg-variant-53b598740d9569b4__L1-4x4__env-toy-2d-trivial-mode",
        "phase12-candidate-0__bg-variant-53b598740d9569b4__L2-8x8__env-imported-repo-benchmark-mode",
        "phase12-candidate-0__bg-variant-53b598740d9569b4__L2-8x8__env-structured-4x4-mode",
        "phase12-candidate-0__bg-variant-53b598740d9569b4__L2-8x8__env-toy-2d-trivial-mode",
        "phase12-candidate-0__bg-variant-95ee11778cc7ac01__L0-2x2__env-imported-repo-benchmark-mode",
        "phase12-candidate-0__bg-variant-95ee11778cc7ac01__L0-2x2__env-structured-4x4-mode",
        "phase12-candidate-0__bg-variant-95ee11778cc7ac01__L0-2x2__env-toy-2d-trivial-mode",
        "phase12-candidate-0__bg-variant-95ee11778cc7ac01__L1-4x4__env-imported-repo-benchmark-mode",
        "phase12-candidate-0__bg-variant-95ee11778cc7ac01__L1-4x4__env-structured-4x4-mode",
        "phase12-candidate-0__bg-variant-95ee11778cc7ac01__L1-4x4__env-toy-2d-trivial-mode",
        "phase12-candidate-0__bg-variant-95ee11778cc7ac01__L2-8x8__env-imported-repo-benchmark-mode",
        "phase12-candidate-0__bg-variant-95ee11778cc7ac01__L2-8x8__env-structured-4x4-mode",
        "phase12-candidate-0__bg-variant-95ee11778cc7ac01__L2-8x8__env-toy-2d-trivial-mode",
        "phase12-candidate-0__bg-variant-d840fea6e6d36748__L0-2x2__env-imported-repo-benchmark-mode",
        "phase12-candidate-0__bg-variant-d840fea6e6d36748__L0-2x2__env-structured-4x4-mode",
        "phase12-candidate-0__bg-variant-d840fea6e6d36748__L0-2x2__env-toy-2d-trivial-mode",
        "phase12-candidate-0__bg-variant-d840fea6e6d36748__L1-4x4__env-imported-repo-benchmark-mode",
        "phase12-candidate-0__bg-variant-d840fea6e6d36748__L1-4x4__env-structured-4x4-mode",
        "phase12-candidate-0__bg-variant-d840fea6e6d36748__L1-4x4__env-toy-2d-trivial-mode",
        "phase12-candidate-0__bg-variant-d840fea6e6d36748__L2-8x8__env-imported-repo-benchmark-mode",
        "phase12-candidate-0__bg-variant-d840fea6e6d36748__L2-8x8__env-structured-4x4-mode",
        "phase12-candidate-0__bg-variant-d840fea6e6d36748__L2-8x8__env-toy-2d-trivial-mode",
        "phase12-candidate-0__bg-variant-d84f5d66fd98b842__L0-2x2__env-imported-repo-benchmark-mode",
        "phase12-candidate-0__bg-variant-d84f5d66fd98b842__L0-2x2__env-structured-4x4-mode",
        "phase12-candidate-0__bg-variant-d84f5d66fd98b842__L0-2x2__env-toy-2d-trivial-mode",
        "phase12-candidate-0__bg-variant-d84f5d66fd98b842__L1-4x4__env-imported-repo-benchmark-mode",
        "phase12-candidate-0__bg-variant-d84f5d66fd98b842__L1-4x4__env-structured-4x4-mode",
        "phase12-candidate-0__bg-variant-d84f5d66fd98b842__L1-4x4__env-toy-2d-trivial-mode",
        "phase12-candidate-0__bg-variant-d84f5d66fd98b842__L2-8x8__env-imported-repo-benchmark-mode",
        "phase12-candidate-0__bg-variant-d84f5d66fd98b842__L2-8x8__env-structured-4x4-mode",
        "phase12-candidate-0__bg-variant-d84f5d66fd98b842__L2-8x8__env-toy-2d-trivial-mode"
      ],
      "sourceFamilyId": "phase22-family-phase12-candidate-0",
      "massLikeValue": 1.0948341340367947E-15,
      "uncertainty": {
        "branchVariation": 6.182857100711135E-19,
        "refinementError": 0,
        "extractionError": 1.0000000000000003E-18,
        "environmentSensitivity": 6.587890399071242E-19,
        "totalUncertainty": 1.3476944083804356E-18
      },
      "branchSelectors": [
        "bg-variant-53b598740d9569b4",
        "bg-variant-95ee11778cc7ac01",
        "bg-variant-d840fea6e6d36748",
        "bg-variant-d84f5d66fd98b842"
      ],
      "environmentSelectors": [
        "env-imported-repo-benchmark",
        "env-structured-4x4",
        "env-toy-2d-trivial"
      ],
      "refinementLevels": [
        "L0-2x2",
        "L1-4x4",
        "L2-8x8"
      ],
      "branchStabilityScore": 0.9994352699730037,
      "refinementStabilityScore": 1,
      "backendStabilityScore": 1,
      "observationStabilityScore": 1,
      "ambiguityCount": 0,
      "gaugeLeakEnvelope": [
        0,
        0,
        0
      ],
      "claimClass": "C2_BranchStableCandidate",
      "status": "candidate-source-ready",
      "assumptions": [
        "source candidate is internal and particle-identity-neutral",
        "selector-aware mass-like value is not a W or Z physical prediction"
      ],
      "closureRequirements": [],
      "provenance": {
        "createdAt": "2026-04-26T00:00:00+00:00",
        "codeRevision": "working-tree",
        "branch": {
          "branchId": "phase22-selector-source-spectra",
          "schemaVersion": "1.0"
        },
        "backend": "cpu"
      }
    },
    {
      "sourceCandidateId": "phase22-phase12-candidate-1",
      "sourceOrigin": "internal-computed-artifact",
      "modeRole": "vector-boson-source-candidate",
      "sourceArtifactPaths": [
        "studies/phase43_selector_eigen_wz_source_spectra_001/source_spectra/spectra_manifest.json",
        "studies/phase43_selector_eigen_wz_source_spectra_001/source_spectra/mode_families.json"
      ],
      "sourceModeIds": [
        "phase12-candidate-1__bg-variant-53b598740d9569b4__L0-2x2__env-imported-repo-benchmark-mode",
        "phase12-candidate-1__bg-variant-53b598740d9569b4__L0-2x2__env-structured-4x4-mode",
        "phase12-candidate-1__bg-variant-53b598740d9569b4__L0-2x2__env-toy-2d-trivial-mode",
        "phase12-candidate-1__bg-variant-53b598740d9569b4__L1-4x4__env-imported-repo-benchmark-mode",
        "phase12-candidate-1__bg-variant-53b598740d9569b4__L1-4x4__env-structured-4x4-mode",
        "phase12-candidate-1__bg-variant-53b598740d9569b4__L1-4x4__env-toy-2d-trivial-mode",
        "phase12-candidate-1__bg-variant-53b598740d9569b4__L2-8x8__env-imported-repo-benchmark-mode",
        "phase12-candidate-1__bg-variant-53b598740d9569b4__L2-8x8__env-structured-4x4-mode",
        "phase12-candidate-1__bg-variant-53b598740d9569b4__L2-8x8__env-toy-2d-trivial-mode",
        "phase12-candidate-1__bg-variant-95ee11778cc7ac01__L0-2x2__env-imported-repo-benchmark-mode",
        "phase12-candidate-1__bg-variant-95ee11778cc7ac01__L0-2x2__env-structured-4x4-mode",
        "phase12-candidate-1__bg-variant-95ee11778cc7ac01__L0-2x2__env-toy-2d-trivial-mode",
        "phase12-candidate-1__bg-variant-95ee11778cc7ac01__L1-4x4__env-imported-repo-benchmark-mode",
        "phase12-candidate-1__bg-variant-95ee11778cc7ac01__L1-4x4__env-structured-4x4-mode",
        "phase12-candidate-1__bg-variant-95ee11778cc7ac01__L1-4x4__env-toy-2d-trivial-mode",
        "phase12-candidate-1__bg-variant-95ee11778cc7ac01__L2-8x8__env-imported-repo-benchmark-mode",
        "phase12-candidate-1__bg-variant-95ee11778cc7ac01__L2-8x8__env-structured-4x4-mode",
        "phase12-candidate-1__bg-variant-95ee11778cc7ac01__L2-8x8__env-toy-2d-trivial-mode",
        "phase12-candidate-1__bg-variant-d840fea6e6d36748__L0-2x2__env-imported-repo-benchmark-mode",
        "phase12-candidate-1__bg-variant-d840fea6e6d36748__L0-2x2__env-structured-4x4-mode",
        "phase12-candidate-1__bg-variant-d840fea6e6d36748__L0-2x2__env-toy-2d-trivial-mode",
        "phase12-candidate-1__bg-variant-d840fea6e6d36748__L1-4x4__env-imported-repo-benchmark-mode",
        "phase12-candidate-1__bg-variant-d840fea6e6d36748__L1-4x4__env-structured-4x4-mode",
        "phase12-candidate-1__bg-variant-d840fea6e6d36748__L1-4x4__env-toy-2d-trivial-mode",
        "phase12-candidate-1__bg-variant-d840fea6e6d36748__L2-8x8__env-imported-repo-benchmark-mode",
        "phase12-candidate-1__bg-variant-d840fea6e6d36748__L2-8x8__env-structured-4x4-mode",
        "phase12-candidate-1__bg-variant-d840fea6e6d36748__L2-8x8__env-toy-2d-trivial-mode",
        "phase12-candidate-1__bg-variant-d84f5d66fd98b842__L0-2x2__env-imported-repo-benchmark-mode",
        "phase12-candidate-1__bg-variant-d84f5d66fd98b842__L0-2x2__env-structured-4x4-mode",
        "phase12-candidate-1__bg-variant-d84f5d66fd98b842__L0-2x2__env-toy-2d-trivial-mode",
        "phase12-candidate-1__bg-variant-d84f5d66fd98b842__L1-4x4__env-imported-repo-benchmark-mode",
        "phase12-candidate-1__bg-variant-d84f5d66fd98b842__L1-4x4__env-structured-4x4-mode",
        "phase12-candidate-1__bg-variant-d84f5d66fd98b842__L1-4x4__env-toy-2d-trivial-mode",
        "phase12-candidate-1__bg-variant-d84f5d66fd98b842__L2-8x8__env-imported-repo-benchmark-mode",
        "phase12-candidate-1__bg-variant-d84f5d66fd98b842__L2-8x8__env-structured-4x4-mode",
        "phase12-candidate-1__bg-variant-d84f5d66fd98b842__L2-8x8__env-toy-2d-trivial-mode"
      ],
      "sourceFamilyId": "phase22-family-phase12-candidate-1",
      "massLikeValue": 1.1811841505574395E-15,
      "uncertainty": {
        "branchVariation": 6.147005935071826E-19,
        "refinementError": 0,
        "extractionError": 1.0000000000000003E-18,
        "environmentSensitivity": 6.744922362437219E-19,
        "totalUncertainty": 1.3538081830197142E-18
      },
      "branchSelectors": [